{"schema":"ling.semantic/0.1","language_version":"0.0.1-dev","unicode_version":"17.0.0","program_id":"experimental:blake3:0000000000000000000000000000000000000000000000000000000000000000","entry_module":"Main","modules":[{"name":"Main","explicit":true,"requires":[],"imports":[]}],"definitions":[],"nodes":[],"references":[]}
